{
  "parent": null,
  "timestamp": "2025-01-13T10:00:00Z",
  "author": {"name": "Rag User", "email": "rag@example.com"},
  "purpose": "Add AI search index",
  "delta": {"added": ["search/chunks.jsonl", "search/metadata.json"], "changed": [], "removed": []},
  "commit_id": "pla:demo:rag:0001",
  "signatures": [],
  "anchors": []
}
