{
  "parent": null,
  "timestamp": "2025-01-13T10:00:00Z",
  "author": {"name": "Search", "email": "search@example.com"},
  "purpose": "Index",
  "delta": {"added": ["search/chunks.jsonl", "search/metadata.json"], "changed": [], "removed": []},
  "commit_id": "pla:test:unk:0001",
  "signatures": [],
  "anchors": []
}
